{"$schema":"https://json-schema.org/draft/2020-12/schema","$id":"ai.openbox.project-observation.effects/v1","type":"object","additionalProperties":false,"required":["schema","safe_sink","retrieval_poison","model_route","core_relay"],"properties":{"schema":{"const":"ai.openbox.project-observation.effects/v1"},"safe_sink":{"type":"object","additionalProperties":false,"required":["status","attempts","matching_receipts","evaluation_id","matched_at"],"properties":{"status":{"enum":["observed","missing"]},"attempts":{"type":"integer","minimum":0},"matching_receipts":{"type":"integer","minimum":0},"evaluation_id":{"type":"string"},"matched_at":{"type":"string"}}},"retrieval_poison":{"type":"object","additionalProperties":false,"required":["status","matching_receipts"],"properties":{"status":{"enum":["observed","missing"]},"matching_receipts":{"type":"integer","minimum":0}}},"model_route":{"type":"object","additionalProperties":false,"required":["status","matching_receipts","provider","model","model_digest"],"properties":{"status":{"enum":["observed","missing"]},"matching_receipts":{"type":"integer","minimum":0},"provider":{"type":"string"},"model":{"type":"string"},"model_digest":{"type":"string","pattern":"^sha256:[0-9a-f]{64}$"},"observed_at":{"type":"string"}}},"core_relay":{"type":"object","additionalProperties":false,"required":["status","matching_validations","governance_events"],"properties":{"status":{"enum":["observed","missing"]},"matching_validations":{"type":"integer","minimum":0},"governance_events":{"type":"integer","minimum":0}}}}}