{"core_relay":{"governance_events":6,"matching_validations":1,"status":"observed"},"model_route":{"matching_receipts":0,"model":"granite4.1:3b","model_digest":"sha256:6fd349357287c7ffc9e38189a93b48ea175d24fc566b38f09cfc564fb7f303eb","provider":"openai-compatible-provider","status":"missing"},"retrieval_poison":{"matching_receipts":0,"status":"missing"},"safe_sink":{"attempts":1,"evaluation_id":"ev-656213e0d3ddc7400f324769","matched_at":"2026-08-26T11:15:43.001Z","matching_receipts":1,"status":"observed"},"schema":"ai.openbox.project-observation.effects/v1"}